Sheet: Sheet1
B1: Y-Values Sheet1.C5:Sheet1.C5 | C1: Column C
A2: Y-Values Sheet1.C5:Sheet1.C5 | B2: 17 | C2: 17
B3: 16 | C3: 16
B4: 8 | C4: 8
B5: 9 | C5: 9
B6: 1 | C6: 1
B7: 3 | C7: 3
B8: 2 | C8: 2
B9: 3 | C9: 3
B10: 20 | C10: 20
B11: 10 | C11: 10
B12: 17 | C12: 17
B13: 2 | C13: 2
B14: 14 | C14: 14
B15: 0 | C15: 0
B16: 1 | C16: 1
B17: 14 | C17: 14
B18: 8 | C18: 8
B19: 1 | C19: 1
B20: 4 | C20: 4
B21: 8 | C21: 8
A22: My Random Numbers
B26: X-Values | C26: Y-Values
B27: 1 | C27: of:=ROUND(MOD((RAND() * 100);20)) -> 17
B28: 2 | C28: of:=ROUND(MOD((RAND() * 100);20)) -> 16
B29: 3 | C29: of:=ROUND(MOD((RAND() * 100);20)) -> 8
B30: 4 | C30: of:=ROUND(MOD((RAND() * 100);20)) -> 9
B31: 5 | C31: of:=ROUND(MOD((RAND() * 100);20)) -> 1
B32: 6 | C32: of:=ROUND(MOD((RAND() * 100);20)) -> 3
B33: 7 | C33: of:=ROUND(MOD((RAND() * 100);20)) -> 2
B34: 8 | C34: of:=ROUND(MOD((RAND() * 100);20)) -> 3
B35: 9 | C35: of:=ROUND(MOD((RAND() * 100);20)) -> 20
B36: 10 | C36: of:=ROUND(MOD((RAND() * 100);20)) -> 10
B37: 11 | C37: of:=ROUND(MOD((RAND() * 100);20)) -> 17
B38: 12 | C38: of:=ROUND(MOD((RAND() * 100);20)) -> 2
B39: 13 | C39: of:=ROUND(MOD((RAND() * 100);20)) -> 14
B40: 14 | C40: of:=ROUND(MOD((RAND() * 100);20)) -> 0
B41: 15 | C41: of:=ROUND(MOD((RAND() * 100);20)) -> 1
B42: 16 | C42: of:=ROUND(MOD((RAND() * 100);20)) -> 14
B43: 17 | C43: of:=ROUND(MOD((RAND() * 100);20)) -> 8
B44: 18 | C44: of:=ROUND(MOD((RAND() * 100);20)) -> 1
B45: 19 | C45: of:=ROUND(MOD((RAND() * 100);20)) -> 4
B46: 20 | C46: of:=ROUND(MOD((RAND() * 100);20)) -> 8